company_id,name,industry,city,country,founded,hq,overview,emp_count
rollins-inc.,"Rollins, Inc.",consumer services,,,1948.0,,"Rollins, Inc. is a premier North American consumer and commercial services company. Through its wholly owned subsidiaries, Orkin, Inc., PCO Services, HomeTeam Pest Defense, Western Pest Services, The Industrial Fumigant Company and Crane Pest Control, the Company provides essential pest control services and protection against termite damage, rodents and insects to over 2 million customers in the United States, Canada, Mexico, Central America, the Caribbean, the Middle East and Asia from over 500 locations. You can learn more about our subsidiaries by visiting our Web sites at www.orkin.com, www.pestdefense.com, www.westernpest.com, www.indfumco.com, and www.rollins.com. You can also find this and other news releases at www.rollins.com by accessing the news releases button.",1859.0
newellbrands,Newell Brands,consumer goods,Hoboken,United States,,"221 River Street Hoboken, NJ 07030 United States","Newell Brands (NYSE: NWL) is a leading global consumer goods company with a strong portfolio of well-known brands, including Paper Mate®, Sharpie®, Dymo®, EXPO®, Parker®, Elmer's®, Coleman®, Jostens®, Marmot®, Rawlings®, Oster®, Sunbeam®, FoodSaver®, Mr. Coffee®, Rubbermaid Commercial Products®, Graco®, Baby Jogger®, NUK®, Calphalon®, Rubbermaid®, Contigo®, First Alert®, Waddington and Yankee Candle®. 	 

We are focused on driving growth acceleration. 

At Newell Brands, a $16 billion consumer goods powerhouse formed by the combination of Newell Rubbermaid Inc. and Jarden Corporation, our aspirations are bigger and bolder than ever. We are driven by the prospect of building one of the leading consumer goods companies in the world – a company that helps consumers live better every day, where they live, learn, work and play. 

We’re focused on driving a performance culture and building a bigger, stronger, faster growing and more profitable company. With a team fit for the company we aspire to be, we’ll do more than we ever thought possible. Will you join us?

Search for career opportunities at Newell Brands to help us shape the future of the company.

 ",17243.0
netapp,NetApp,information technology and services,Sunnyvale,United States,1992.0,"495 E Java Dr Sunnyvale, California 94089 United States","NetApp creates innovative storage and data management solutions that help accelerate business breakthroughs and deliver outstanding cost efficiency. Our dedication to principles of simplicity, innovation, and customer success has made us one of the fastest-growing storage and data management providers today.

Customers around the world choose us for our “go beyond” approach and broad portfolio of solutions for cloud computing, flash storage, business applications, data storage for virtual servers, disk-to-disk backup, and more. Our solutions provide nonstop availability of critical business data and simplify business processes so you can deploy new capabilities with confidence and get to revenue faster than ever before. 

You can rely on our industry-leading storage and management solutions to lower the cost of protecting your data, business, and reputation.  We bring together the industry’s best partners and technology to deliver services that help you maximize what you are getting from your infrastructure. Our collaborative approach, working as one team with one goal, means that you get a storage or data management solution that is just right for you—on time and on budget. 

To support your global business, we provide highly-responsive support in local languages. From London to Austin, from Bangalore to Tokyo, we’ll work with you to solve your problems and reach your goals.

Discover our passion for helping companies around the world at www.netapp.com.

Interested in working at NetApp? Search our open jobs - www.netapp.com/us/careers/",24264.0
fortinet,Fortinet,computer & network security,Sunnyvale,United States,2000.0,"899 Kifer Road Sunnyvale, CA 94086 United States","Fortinet (NASDAQ: FTNT) secures the largest enterprise, service provider, and government organizations around the world. Fortinet empowers its customers with intelligent, seamless protection across the expanding attack surface and the power to take on ever-increasing performance requirements of the borderless network - today and into the future. Only the Fortinet Security Fabric architecture can deliver security without compromise to address the most critical security challenges, whether in networked, application, cloud or mobile environments. Fortinet ranks #1 in the most security appliances shipped worldwide and more than 290,000 customers trust Fortinet to protect their businesses. Learn more at http://www.fortinet.com, the Fortinet Blog, or FortiGuard Labs.",4448.0
torchmark-corporation,Torchmark Corporation,financial services,McKinney,United States,,"3700 S Stonebridge Drive P.O. Box 8080 McKinney, TX 75070 United States","Welcome to the official Torchmark Corporation LinkedIn page. Our Success is Earned One Family at a Time™ 

Torchmark Corporation is headquartered in McKinney, Texas, approximately 45 minutes north of Dallas. Torchmark (NYSE: TMK) is a financial services holding company whose affiliate Companies market life insurance and supplemental health insurance to middle-income American families. Torchmark Corporation offers outstanding opportunities throughout the United States and abroad. A Fortune 1000 Company, Torchmark was recognized as one of the Dallas area's top 150 companies by the Dallas Morning News (6/12).",912.0
f5-networks,F5 Networks,computer networking,Seattle,United States,1996.0,"401 Elliott Ave W Seattle, WA 98119 United States","F5, the global leader in Application Delivery Networking (ADN), develops products that strengthen the security, performance, and availability of applications, servers, and datacenters. All of F5 products are highly programmable and integrate into any data environment—cloud, on premise, or hybrid-cloud. With F5, organizations unify disparate technologies and align IT departments to changing business conditions, including those that call for on-demand services. To date, 48 of the Fortune 50 companies rely on F5 to deliver applications that customers and employees can securely access at any time, on any device, from any location. Learn more about what F5 does to make our application world run better at f5.com.",5719.0
pseg,PSEG,utilities,Newark,United States,1903.0,"80 Park Plaza Newark, New Jersey 07101 United States","Public Service Enterprise Group (PSEG) helps to make New Jersey and New York better places to live and work by providing safe, reliable, economic and greener energy that powers the lives of millions every day.

We are New Jersey’s largest provider of electric and gas service, serving 1.8 million gas customers and 3.3 million electric customers in New Jersey and New York. We also own and operate 19 power plants in the Northeast and Mid-Atlantic regions and 36 solar energy facilities in New Jersey and eight other states. 

Headquartered in Newark, N.J., PSEG is a Fortune 500 Company traded on the New York Stock Exchange under the symbol PEG.",8087.0
henry-schein,Henry Schein,medical devices,Melville,United States,1932.0,"135 Duryea Road Melville, NY 11747 United States","Henry Schein, Inc. is the world's largest provider of health care products and services to office-based dental, animal health and medical practitioners. The Company also serves dental laboratories, government and institutional health care clinics, and other alternate care sites. A Fortune 500® Company and a member of the S&P 500® and NASDAQ 100® Indexes, Henry Schein employs more than 19,000 Team Schein Members and serves more than one million customers.
The Company offers a comprehensive selection of products and services, including value-added solutions for operating efficient practices and delivering high-quality care. Henry Schein operates through a centralized and automated distribution network, with a selection of more than 110,000 branded products and Henry Schein private-brand products in stock, as well as more than 150,000 additional products available as special-order items. The Company also offers its customers exclusive, innovative technology solutions, including practice management software and e-commerce solutions, as well as a broad range of financial services.
Headquartered in Melville, N.Y., Henry Schein has operations or affiliates in 33 countries. The Company's sales reached a record $10.6 billion in 2015, and have grown at a compound annual rate of approximately 15 percent since Henry Schein became a public company in 1995. For more information, visit the Henry Schein website at www.henryschein.com",9366.0
etrade,E*TRADE,financial services,,,1982.0,,"E*TRADE is an innovative financial services company offering a full suite of easy-to-use online brokerage, investing and related banking solutions, delivered at a competitive price. We empower individuals to take control of their financial futures by providing the products, tools and services they need to meet their near- and long-term investing goals.

We provide these services to customers online and through our network of customer service representatives, investment professionals, and investment advisors – over the phone and-in person at our 30 E*TRADE branches.

Securities products and services are offered by E*TRADE Securities LLC, Member FINRA/SIPC. Banking products and services are offered by E*TRADE Bank, a Federal savings bank, Member FDIC, or its subsidiaries.  Full portfolio management and advisory services are offered by E*TRADE Capital Management LLC, an investment adviser registered with the Securities and Exchange Commission. E*TRADE Securities LLC, E*TRADE Bank and E*TRADE Capital Management are separate but affiliated companies.

© 2014 E*TRADE Financial Corporation. All rights reserved.",10187.0
sl-green,SL Green Realty Corp.,real estate,New York,United States,1997.0,"420 Lexington Avenue New York, NY 10170 United States","SL Green Realty Corp., an S&P 500 company and New York City's largest office landlord, is a fully integrated real estate investment trust, or REIT, that is focused primarily on acquiring, managing and maximizing value of Manhattan commercial properties.

As of September 30, 2016, the Company held interests in 125 Manhattan buildings totaling 46.6 million square feet. This included ownership interests in 28.1 million square feet of commercial buildings and debt and preferred equity investments secured by 18.6 million square feet of buildings. 

In addition, the Company held ownership interests in 30 suburban buildings totaling 4.8 million square feet in Brooklyn, Long Island, Westchester County, Connecticut and New Jersey.",655.0
baxter-healthcare,Baxter International Inc.,medical devices,,,1931.0,,"Baxter provides a broad portfolio of essential renal and hospital products, including home, acute and in-center dialysis; sterile IV solutions; infusion systems and devices; parenteral nutrition; biosurgery products and anesthetics; and pharmacy automation, software and services. The company’s global footprint and the critical nature of its products and services play a key role in expanding access to healthcare in emerging and developed countries. Baxter’s employees worldwide are building upon the company’s rich heritage of medical breakthroughs to advance the next generation of healthcare innovations that enable patient care.",52029.0
macy,Macy's,retail,Cincinnati,United States,1858.0,"7 West Seventh Street Cincinnati, OH 45202 United States","Macy's, the largest retail brand of Macy's, Inc. (NYSE:M), delivers fashion and affordable luxury to customers at approximately 670 locations in 45 states, the District of Columbia, Puerto Rico and Guam, as well as to customers in the U.S. and more than 100 international destinations through its leading online store at macys.com. Via its stores, e-commerce site, mobile and social platforms, Macy's offers distinctive assortments including the most desired family of exclusive and fashion brands for him, her and home. Macy's is known for such epic events as Macy's 4th of July Fireworks® and the Macy's Thanksgiving Day Parade®, as well as spectacular fashion shows, culinary events, flower shows and celebrity appearances. Macy's flagship stores -- including Herald Square in New York City, Union Square in San Francisco, State Street in Chicago, and Dadeland in Miami and South Coast Plaza in southern California -- are known internationally and are leading destinations for visitors. Building on a more than 150-year tradition, and with the collective support of customers and employees, Macy's helps strengthen communities by supporting local and national charities giving more than $69 million each year to help make a difference in the lives of our customers.",124224.0
itw,ITW,machinery,Glenview,United States,1912.0,"155 Harlem Avenue Glenview, IL 60025 United States","Founded in 1912, ITW (NYSE:ITW)  is a global industrial company centered on a differentiated and proprietary business model. The company’s seven industry leading segments leverage the ITW Business Model to generate solid growth with best-in-class margins and returns in markets where highly innovative, customer focused solutions are required. ITW’s 50,000+ dedicated colleagues around the world thrive in our decentralized, entrepreneurial culture. In 2016, the company achieved revenues of $13.6 billion, with roughly half coming from outside North America. ",6839.0
ulta,Ulta Beauty,retail,Bolingbrook,United States,1990.0,"1000 Remington Blvd Bolingbrook, IL 60440 United States","Ulta Beauty (NASDAQ: ULTA) is the largest beauty retailer in the United States and the premier beauty destination for cosmetics, fragrance, skin care products, hair care products and salon services. Since opening its first store 25 years ago, Ulta Beauty has grown to become the top national retailer providing All Things Beauty, All in One Place™. The Company offers more than 20,000 products from over 500 well-established and emerging beauty brands across all categories and price points, including Ulta Beauty’s own private label. Ulta Beauty also offers a full-service salon in every store featuring hair, skin and brow services. Ulta Beauty is recognized for its commitment to personalized service, fun and inviting stores and its industry-leading Ultamate Rewards loyalty program. As of April 30, 2016, Ulta Beauty operates 886 retail stores across 48 states and the District of Columbia and also distributes its products through its website, which includes a collection of tips, tutorials and social content. For more information, visit www.ulta.com.",18202.0
state-street,State Street,financial services,Boston,United States,,"State Street Financial Center One Lincoln Street Boston, MA 02111 United States","At State Street, we partner with institutional investors all over the world to provide comprehensive financial services, including investment management, investment research and trading, and investment servicing.

Whether you are an asset manager, asset owner, alternative asset manager, insurance company, pension fund or official institution, you can rely on us to be focused on your challenges. We are committed to doing what it takes to help you perform better — now and in the future.",58331.0
firstenergy-corp,FirstEnergy,utilities,Akron,United States,1997.0,"76 South Main Street Akron, OH 44308 United States","FirstEnergy (NYSE: FE) is a diversified energy company dedicated to safety, reliability and operational excellence. Headquartered in Akron, Ohio, FirstEnergy's 10 electric distribution companies form one of the nation's largest investor-owned electric systems; its transmission subsidiaries operate more than 24,000 miles of lines connecting the Midwest and Mid-Atlantic regions, and its generation subsidiaries control nearly 17,000 megawatts of capacity.  

Join the FirstEnergy Careers Facebook community at www.facebook.com/FirstEnergyCareers, where we share career tips, job postings, photos from career fairs and community events, and interesting company facts and news. We also encourage you to learn more about our company and stay up-to-date on current job openings by joining our Talent Network at www.jobs.net/jobs/firstenergy/en-us/join.",6685.0
walgreens,Walgreens,retail,Deerfield,United States,1901.0,"200 Wilmot Road Deerfield, IL 60015 United States","Walgreens (www.walgreens.com), the nation's largest drugstore chain, constitutes the Retail Pharmacy USA Division of Walgreens Boots Alliance, Inc. (Nasdaq: WBA), the first global pharmacy-led, health and wellbeing enterprise.

Our team members make that purpose come to life in our more than 8,000 stores in all 50 states, the District of Columbia and Puerto Rico, in our call centers, distribution centers, clinics, specialty pharmacies, infusion and respiratory service locations and corporate offices. In fact, those daily demonstrations of our purpose have helped Walgreens become an industry leader and a household name. 

Walgreens has something for everyone who wants to build a successful career. Here, you’ll find supportive co-workers, an innovative environment and the tools you need to expand your skills, help build healthy communities and advance your career.


Fortune magazine World's Most Admired Companies (published March 2014)
Walgreens ranked No. 5 among food and drugstores and has been listed for the past 21 consecutive years.

Fortune magazine 500 Largest U.S.-Based Companies (published May 2014)
Walgreens ranked 37th overall in revenue, 3rd among food and drugstores.",112399.0
autodesk,Autodesk,computer software,San Rafael,United States,1982.0,"111 McInnis Pkwy, San Rafael, CA 94903 San Rafael, CA 94903 United States","Autodesk makes software for people who make things.  If you’ve ever driven a high-performance car, admired a towering skyscraper, used a smartphone, or watched a great film, chances are you’ve experienced what millions of Autodesk customers are doing with our software. Autodesk gives you the power to make anything.  

Over 100 million people use Autodesk software like AutoCAD, Revit, Maya, 3ds Max, Fusion 360, SketchBook, and more to unlock their creativity and solve important design, business and environmental challenges. Our software runs on both personal computers and mobile devices and taps the infinite computing power of the cloud to help teams around the world collaborate, design, simulate and fabricate their ideas in 3D.
 
Autodesk is consistently named a Great Place to Work®, globally.  We provide exceptional compensation/benefit packages and we’d love for you to join us. We’re proud to be an equal opportunity employer and we consider all qualiﬁed applicants without regard to race, gender, disability, veteran status or other protected category.  To see our culture in action, check out #AutodeskLife.

We are headquartered in the San Francisco Bay Area and have more than 9000 employees worldwide.
 
2016
Fortune's 25 Best Global Companies to Work For (#8)
World's Best Multinational Workplaces
Great Place to Work Laureate Award
Fortune's Best Company Work For 2016 (#54)


2015
FORTUNE’s Best Company to Work For 2015 List (#52)
Forrester Groundswell Award, given each year to companies that demonstrate excellence in social marketing
Canada’s 100 Best Workplaces List (#3)
Included on Fortune Magazine's Most Admired Companies List 
Placed on the CDP’s first Supplier Climate Performance Leadership Index with an A rating",19832.0
pca,Packaging Corporation of America,packaging and containers,Lake Forest,United States,1959.0,"1955 W. Field Ct. Lake Forest, IL 60045 United States","PCA is the fourth largest producer of containerboard in the United States and the third largest producer of uncoated freesheet in North America, based on production capacity. We have approximately 13,000 employees, with operations primarily in the United States. 

PCA’s Packaging segment includes six containerboard mills and 95 converting operations. In 2015, PCA produced about 3.7 million tons of containerboard and shipped about 48.9 billion square feet (BSF) of corrugated products. 

PCA’s Paper segment operates under the trade name Boise Paper, a Division of Packaging Corporation of America. We manufacture and sell white papers, including both commodity and specialty papers, at three white paper mills located in the United States. 

PCA’s net sales for 2015 were $5.7 billion. The company’s corporate headquarters are located in Lake Forest, Illinois. 

PCA combines great products with a creative and knowledgeable total-service team to provide ideas and solutions for any packaging need: ""When you choose Packaging Corporation of America, you work with people who do the right things for each other and for our customers. We believe in utilizing the power of strong collaborative relationships, bound by the trust we have earned, to deliver innovative packaging solutions and an outstanding service experience.""​",4545.0
robert-half-international,Robert Half,staffing and recruiting,Menlo Park,United States,1948.0,"2884 Sand Hill Road Suite 200 Menlo Park, CA 94025 United States","Robert Half is the world’s first and largest specialized staffing firm, providing skilled professionals in the fields of accounting and finance, technology, legal, creative, marketing, and administration. We have more than 400 consulting and staffing locations worldwide.

Founded in 1948, Robert Half pioneered the concept of professional staffing services. Today, we offer businesses a full spectrum of specialized staffing and consulting solutions. Robert Half has appeared on FORTUNE® magazine's ""Most Admired Companies""​ list every year since 1998 and also appears on Ethisphere's 2013 list of the ""World's Most Ethical Companies.""​ The company is traded on the New York Stock Exchange (symbol: RHI) and is a member of the S&P 500 index and the FTSE4Good Responsible Investment Index. 

Robert Half also is the parent company of Protiviti®, a global consulting and internal audit firm composed of experts in risk, advisory and transaction services.",33487.0
vornado-realty-trust,Vornado Realty Trust,real estate,,United States,,United States,,1600.0
cerner-corporation,Cerner Corporation,information technology and services,Kansas City,United States,1979.0,"2800 Rockcreek Parkway Kansas City, Missouri 64117 United States","Cerner is the leading U.S. supplier of health care information technology solutions that optimize clinical and financial outcomes. Around the world, health organizations ranging from single-doctor practices to entire countries turn to Cerner (NASDAQ: CERN) for our powerful yet intuitive solutions. Cerner offers clients a dedicated focus on health care, an end-to-end solution and service portfolio, and proven market leadership.",29582.0
walmart,Walmart,retail,,,1962.0,,"At Walmart, we help people save money so they can live better. This mission serves as the foundation for every decision we make, from responsible sourcing to sustainability—and everything in between. As a Walmart associate, you will play an integral role in shaping the future of retail, tech, merchandising, finance and hundreds of other industries—all while affecting the lives of millions of customers all over the world. Here, your work makes an impact every day. What are you waiting for?",294095.0
cummins-inc,Cummins Inc.,automotive,,,1919.0,,"Cummins Inc., a global power leader, is a corporation of complementary business units that design, manufacture, distribute and service diesel and natural gas engines and related technologies, including fuel systems, controls, air handling, filtration, emission solutions and electrical power generation systems.

Headquartered in Columbus, Indiana, (USA) Cummins currently employs approximately 55,000 people worldwide and serves customers in approximately 190 countries and territories through a network of approximately 600 company-owned and independent distributor locations and approximately 7,200 dealer locations. Cummins earned $1.4 billion on sales of $19.1 billion in 2015.",39601.0
udr,UDR - Opening Doors to your future,real estate,Highlands Ranch,United States,1972.0,"1745 Shea Center Drive Suite 200 Highlands Ranch, Colorado 80129 United States","UDR, Inc. (NYSE:UDR), an S&P 500 company, is a leading multifamily real estate investment trust with a demonstrated performance history of delivering superior and dependable returns by successfully managing, buying, selling, developing and redeveloping attractive real estate properties in targeted U.S. markets. As of December 31, 2016, UDR owned or had an ownership position in 49,907 apartment homes including 3,604 homes under development or in preferred equity investments. For over 45 years, UDR has delivered long-term value to shareholders, the best standard of service to residents and the highest quality experience for associates.   ",2695.0
