company_id,name,industry,city,country,founded,hq,overview,emp_count
mattel,"Mattel, Inc.",consumer goods,,,1945.0,,"Mattel is a creations company that inspires the wonder of childhood. Our mission is to be the recognized leader in play, learning and development worldwide. Mattel’s portfolio of global consumer brands includes American Girl®, Barbie®, Fisher-Price®, Hot Wheels®, Monster High® and Thomas & Friends®, among many others. Mattel also creates a wealth of lines and products made in collaboration with leading entertainment and technology companies. With a global workforce of approximately 31,000 people, Mattel operates in 40 countries and territories and sells products in more than 150 nations. Visit us online at www.mattel.com.",15742.0
unitedhealth-group,UnitedHealth Group,hospital & health care,,United States,1980.0,United States,"Our mission is to help people live healthier lives and to help make the health system work better for everyone.

A Fortune 6 company, we're focused on helping people live healthier lives while making the health system work better for everyone. Here, we seek to empower people with the information, guidance and tools to make personal health choices. We work harder and we aim higher. We expect more from ourselves and each other. And, at the end of the day, we’re doing a lot of good for more than 85 million people worldwide.

Our biggest point of differentiation is our people - and the collective talent, energy, intelligence and drive our force of 188,000 individuals around the world bring to our mission every single day. So, how do we do it? With our every action, interaction and intention that demonstrates the five fundamental values that guide everything we do:

     •  Integrity 
     •  Compassion 
     •  Relationships 
     •  Innovation 
     •  Performance 

If you're looking for a place where your drive, compassion and passion can make a difference in the health and well-being of others, consider UnitedHealth Group. Click below to search careers or join our social communities: 

     • Search and apply for careers at: http://careers.unitedhealthgroup.com
     • Like us on Facebook at: http://www.facebook.com/uhgcareers
     • Follow us on Twitter at: http://www.twitter.com/uhgcareers

Diversity creates a healthier atmosphere: All qualified applicants will receive consideration for employment without regard to race, color, religion, sex, age, national origin, protected veteran status, disability status, sexual orientation, gender identity or expression, marital status, genetic information, or any other characteristic protected by law.

UnitedHealth Group is a drug-free workplace. Candidates are required to pass a drug test before beginning employment.",111698.0
regions-financial-corporation,Regions Bank,banking,,,1971.0,,"Regions Financial Corporation, with $125 billion in assets, is a member of the S&P 500 Index and is one of the nation’s largest full-service providers of consumer and commercial banking, wealth management, mortgage and insurance products and services. Regions serves customers in 16 states across the South, Midwest and Texas, and through its subsidiary, Regions Bank, operates approximately 1,600 banking offices and 2,000 ATMs. 


Our Company Mission

We are Regions. And ours is a vibrant mission. Make life better. Make life better for associates. Make life better for our customers. Make life better for our communities. This is our roadmap to success. Our roadmap to create strong, consistent shareholder value. 

Regions'​ five core values guide everything we do: 

• Do What Is Right 
• Put People First 
• Reach Higher 
• Focus On Your Customer 
• Enjoy Life

You'll find our full Social Media Community Guidelines at http://regions.com/social.

Equal Housing Lender | Member FDIC",28471.0
apple,Apple,consumer electronics,Cupertino,United States,1976.0,"1 Infinite Loop Cupertino, CA 95014 United States","Apple revolutionized personal technology with the introduction of the Macintosh in 1984. Today, Apple leads the world in innovation with iPhone, iPad, the Mac and Apple Watch. Apple’s three software platforms — iOS, OS X and watchOS — provide seamless experiences across all Apple devices and empower people with breakthrough services including the App Store, Apple Music, Apple Pay and iCloud. Apple’s 100,000 employees are dedicated to making the best products on earth, and to leaving the world better than we found it.

Apple is an Equal Employment Opportunity Employer that is committed to inclusion and diversity. We also take affirmative action to offer employment and advancement opportunities to all applicants, including minorities, women, protected veterans, and individuals with disabilities.",180258.0
hasbro,Hasbro,consumer goods,Pawtucket,United States,1923.0,"1027 Newport Ave. Pawtucket, RI 02861 United States","Hasbro (NASDAQ: HAS) is a global play and entertainment company committed to Creating the World's Best Play Experiences. From toys and games to television, movies, digital gaming and consumer products, Hasbro offers a variety of ways for audiences to experience its iconic brands, including NERF, MY LITTLE PONY, TRANSFORMERS, PLAY-DOH, MONOPOLY, LITTLEST PET SHOP and MAGIC: THE GATHERING, as well as premier partner brands. The Company's Hasbro Studios and its film label, Allspark Pictures, are building its brands globally through great storytelling and content on all screens. Through its commitment to corporate social responsibility and philanthropy, Hasbro is helping to make the world a better place for children and their families. Learn more at www.hasbro.com, and follow us on Twitter (@Hasbro & @HasbroNews) and Instagram (@Hasbro).",10580.0
national-oilwell-varco,National Oilwell Varco,oil & energy,,,1841.0,,"National Oilwell Varco (NYSE: NOV) is a worldwide leader in the design, manufacture and sale of equipment and components used in oil and gas drilling and production operations, and the provision of oilfield services to the oil and gas industry.

Every day, thousands of the industry’s best minds put more than 150 years of experience to work to help our customers achieve lasting success. Our partnership with our customers has led to the innovation of some of the highest quality products on the market.

Through our broad capabilities and vision, NOV’s family of companies is positioned and ready to serve the needs of this challenging, evolving industry. NOV has the technical expertise, advanced equipment and readily available support necessary for our customers’ success.",34089.0
amgen,Amgen,biotechnology,Thousand Oaks,United States,1980.0,"One Amgen Center Drive Thousand Oaks, CA 91320 United States","Amgen is committed to unlocking the potential of biology for patients suffering from serious illnesses by discovering, developing, manufacturing and delivering innovative human therapeutics. This approach begins by using tools like advanced human genetics to unravel the complexities of disease and understand the fundamentals of human biology.

Amgen focuses on areas of high unmet medical need and leverages its expertise to strive for solutions that improve health outcomes and dramatically improve people's lives. A biotechnology pioneer since 1980, Amgen has grown to be one of the world's leading independent biotechnology companies, has reached millions of patients around the world and is developing a pipeline of medicines with breakaway potential.

For more information, visit www.amgen.com and follow us on www.twitter.com/amgen.

Special Advisory: Please be cautious of scam recruitment offers claiming to be from Amgen. Such scams may come from various sources, including fake websites and/or unsolicited emails and seek to obtain personal data or payment from victims by offering jobs that do not exist. Please be advised that Amgen would never ask for payment to progress a job application. When in doubt, please check to see if the position in question is posted on this website before applying. Additionally, please report any suspicious recruiting activity to https://complaint.ic3.gov/ and thank you for your assistance.",41608.0
edison-international,Edison International,utilities,Rosemead,United States,,"2244 Walnut Grove Ave Rosemead, CA 91770 United States","Edison International, through its subsidiaries, is a generator and distributor of electric power and an investor in infrastructure and energy assets, including renewable energy. Headquartered in Rosemead, California, Edison International is the parent company of Southern California Edison, one of the nation's largest electric utilities.",2539.0
us-bank,U.S. Bank,banking,Minneapolis,United States,,"800 Nicollet Mall Minneapolis, MN 55402 United States","We believe in putting people first, and our dedication to making ethical decisions and doing the right thing is at the heart of what we do. We're proud to be named by Ethisphere as a 2016 World's Most Ethical Company. 

We work to meet our customers’ business and personal banking needs with competitive products and services, convenient access to their accounts, and proven stability backed by industry-leading financial metrics. With more than 4,800 ATMS, 3,114 branch locations, 24-hour phone support and mobile and online banking, we make it easy for our customers to manage their money any time. 

Please note: Equal Housing Lender. Credit products are offered by U.S Bank National Association and subject to normal credit approval. Some restrictions may apply. Deposit products offered by U.S. Bank National Association. Member FDIC.",67327.0
norwegian-cruise-line,Norwegian Cruise Line Holdings Ltd. ,"leisure, travel & tourism",Miami,United States,1966.0,"7665 Corporate Center Drive Miami, FL 33126 United States","Norwegian Cruise Line is the innovator in cruise travel with a 50-year history of breaking the boundaries of traditional cruising, most notably with the introduction of Freestyle Cruising which revolutionized the industry by giving guests more freedom and flexibility. Today, Norwegian invites guests to “Cruise Like a Norwegian” on one of 15 purpose-built Freestyle Cruising ships, providing guests the opportunity to enjoy a relaxed, resort style cruise vacation on some of the newest and most contemporary ships at sea. Recently, the line was named “Europe’s Leading Cruise Line” for the seventh consecutive year, as well as “Caribbean’s Leading Cruise Line” for the third time and “World’s Leading Large Ship Cruise Line” for the second year by the World Travel Awards.",11739.0
oxy,Oxy,oil & energy,Houston,United States,,"5 Greenway Plaza, Ste 110 Houston, TX 77046 United States","Occidental Petroleum Corporation (NYSE:OXY) is an international oil and gas exploration and production company — one of the largest in the U.S., based on market capitalization — and our OxyChem subsidiary is a major North American chemical manufacturer.

Oxy is an industry leader in applying advanced technology to boost production and access hard-to-recover reserves. With more than 40,000 employees and contractors worldwide, we are committed to being the employer, partner and neighbor of choice.

Oil and natural gas operations are the core of Oxy’s business. Our exploration and production activities are concentrated in three geographic regions: the United States, Middle East region and Latin America. In each of these regions, we focus on long-lived, “legacy” oil and gas assets with long-term production growth potential. Oxy is well-positioned for success in today’s dynamic and complex business environment. 

Occidental Chemical Corporation (OxyChem) is a leading North American manufacturer of polyvinyl chloride (PVC) resins, chlorine and caustic soda – key building blocks for a variety of indispensable products such as plastics, pharmaceuticals and water treatment chemicals. For every product it markets in the U.S., OxyChem's market position is No. 1 or No. 2.  Based in Dallas, Texas, the company has manufacturing facilities in the United States, Canada and Chile.

Click here to learn more about Oxy: http://www.oxy.com/investors/Profile/Pages/default.aspx",14831.0
costco-wholesale,Costco Wholesale,retail,,,1983.0,,"Costco Wholesale is a multibillion dollar global retailer with warehouse club operations in 10 countries. We are the recognized leader in our field, dedicated to quality in every area of our business and respected for our outstanding business ethics. Despite our large size and rapid international expansion, we continue to provide an atmosphere in which our employees thrive and succeed. 

If you are an ambitious, energetic person who enjoys a fast-paced team environment filled with challenges and opportunities, you've come to the right place. Our successful employees are service-oriented with integrity and commitment toward a common goal of excellence. Costco offers great jobs, great pay, great benefits and a great place to work.

Like us on Facebook: www.facebook.com/Costco
Follow us on Pinterest: www.pinterest.com/Costco",45363.0
american-express,American Express,financial services,New York,United States,,"World Financial Center, 200 Vesey Street New York, NY 10285 United States","American Express is a global service company, providing customers with exceptional access to products, insights and experiences that enrich lives and build business success.

Each day, American Express makes it easier, safer and more rewarding for consumers and businesses to purchase the things they need and for merchants to sell their goods and services. An engine of commerce, American Express provides innovative payment, travel and expense management solutions for individuals and businesses of all sizes. Most of all, we help our customers realize their dreams and aspirations through industry-leading benefits, access to unique experiences, business-building insights, and global customer care. We enable our customers to do and achieve more.

Learn more about us at: 

https://www.americanexpress.com/
https://www.facebook.com/AmericanExpressUS
http://www.foursquare.com/americanexpress
https://twitter.com/americanexpress
https://www.youtube.com/user/AmericanExpress

See our community guidelines at:

http://amex.co/guidelineslinkedin

If you have a customer service issue or question, please visit www.americanexpress.com/contactus",114247.0
alexandria-real-estate-equities-inc-,"Alexandria Real Estate Equities, Inc.",real estate,,,1994.0,,"Alexandria Real Estate Equities, Inc. (NYSE:ARE) is an urban office REIT uniquely focused on world-class collaborative science and technology campuses in AAA innovation cluster locations. Alexandria pioneered this niche in 1994 and has since established a dominant market presence in key locations, including Greater Boston, San Francisco, New York City, San Diego, Seattle, Maryland, and Research Triangle Park. Alexandria is known for its high-quality and diverse tenant base. Alexandria has a longstanding and proven track record of developing Class A assets clustered in urban science and technology campuses that provide its innovative tenants with highly dynamic and collaborative environments that enhance their ability to successfully recruit and retain world-class talent and inspire productivity, efficiency, creativity, and success.",425.0
dovercorp,Dover Corporation,machinery,Downers Grove,United States,,"3005 Highland Parkway, Suite 200 Downers Grove, IL 60515 United States","Dover is a diversified global manufacturer with annual revenues of approximately $7 billion. We deliver innovative equipment and components, specialty systems and support services through four major operating segments: Energy, Engineered Systems, Fluids, and Refrigeration & Food Equipment. Dover combines global scale with operational agility to lead the markets we serve. Recognized for our entrepreneurial approach for 60 years, our team of over 26,000 employees takes an ownership mindset, collaborating with customers to redefine what’s possible. Headquartered in Downers Grove, Illinois, Dover trades on the New York Stock Exchange under “DOV.” Additional information is available at www.dovercorporation.com.",1459.0
jefferies,Jefferies,investment banking,New York City,United States,1962.0,"520 Madison Avenue, 10th Floor New York City, New York 10022 United States","Jefferies, the global investment banking firm, has served companies and investors for over 50 years. Headquartered in New York, with offices in over 30 cities around the world, the firm provides clients with capital markets and financial advisory services, institutional brokerage and securities research, as well as wealth management. The firm provides research and execution services in equity, fixed income, and foreign exchange markets, as well as a full range of investment banking services including underwriting, mergers and acquisitions, restructuring and recapitalization, and other advisory services, with all businesses operating in the Americas, Europe and Asia. 

Jefferies Group LLC is a wholly-owned subsidiary of Leucadia National Corporation (NYSE: LUK), a diversified holding company. Jefferies Group LLC’s principal operating subsidiaries are Jefferies LLC in the U.S., Jefferies International Limited in Europe and Jefferies Hong Kong Limited in Asia. Jefferies International Limited is authorized and regulated in the United Kingdom by the Financial Conduct Authority.",8581.0
valero-energy-corporation,Valero Energy Corporation,oil & energy,San Antonio,United States,1980.0,"One Valero Way San Antonio, TX 78249 United States","Valero Energy Corporation, through its subsidiaries, is an international manufacturer and marketer of transportation fuels, petrochemical products and power. Valero subsidiaries employ approximately 10,000 people, and assets include 15 petroleum refineries with a combined throughput capacity of approximately 2.9 million barrels per day, 11 ethanol plants with a combined production capacity of 1.3 billion gallons per year, and a 50-megawatt wind farm. More than 7,400 outlets carry the Valero, Diamond Shamrock, Shamrock and Beacon brands in the United States and the Caribbean; Ultramar in Canada; and Texaco in the United Kingdom and Ireland. Through subsidiaries, Valero owns the general partner of Valero Energy Partners LP, a midstream master limited partnership. Valero is a Fortune 500 company based in San Antonio.

Valero's employees are the heart of its success, and there is a reason why the company is an employer of choice in the fuels manufacturing and marketing industry. It’s not just the excellent benefits package, or the opportunities for personal growth, it’s also the caring and committed culture of the organization that makes everyone feel like they’re truly part of a team.",9844.0
constellation-brands,Constellation Brands,wine and spirits,Victor,United States,1945.0,"207 High Point Drive, Bldg. 100 Victor, NY 14564 United States","Constellation Brands is a leading international producer and marketer of beer, wine and spirits with operations in the U.S., Canada, Mexico, New Zealand and Italy.

In 2015, Constellation was one of the top performing stocks in the S&P 500 Consumer Staples Index. Constellation is the number three beer company in the U.S. with high-end, iconic imported brands including Corona Extra, Corona Light, Modelo Especial, Negra Modelo, Pacifico, and Ballast Point, one of the most awarded craft brewers in the U.S. Constellation is also the world's leader in premium wine selling great brands that people love including Robert Mondavi, Clos du Bois, Kim Crawford, Meiomi, Mark West, Franciscan Estate, Ruffino and Jackson-Triggs. The company's premium spirits brands include SVEDKA Vodka and Black Velvet Canadian Whisky.

Based in Victor, N.Y., the company believes that industry leadership involves a commitment to brandbuilding, our trade partners, the environment, our investors and to consumers around the world who choose our products when celebrating big moments or enjoying quiet ones. Founded in 1945, Constellation has grown to become a significant player in the beverage alcohol industry with more than 100 brands in its portfolio, sales in approximately 100 countries, about 40 facilities and approximately 9,000 talented employees. We express our company vision: to elevate life with every glass raised. 

Constellation Brands is the:
•#1 premium wine producer in the world
•#1 multi-category beverage alcohol company in the U.S. 
•#3 beer company in the U.S.
•#1 wine company in Canada
•#1 producer of New Zealand wine",4223.0
mosaiccompany,The Mosaic Company,mining & metals,Plymouth,United States,2004.0,"3033 Campus Drive Suite E490 Plymouth, Minnesota 55441 United States","With 75 million new people to feed each year and a growing worldwide middle class, the global food supply needs to keep pace. This imperative creates the opportunity for The Mosaic Company to deliver on its mission to help the world grow the food it needs.

Mosaic is a global leader in the crop nutrient industry — the only company with the ability to produce and deliver two vital crop nutrients, phosphate and potash, on a massive scale. Mosaic engages in every phase of crop nutrition, from the mining of resources to the production of crop nutrients, feed and industrial products for customers around the globe.

Mosaic encourages an open dialogue on its social media outlets. In doing this, we ask that all users remain respectful and considerate. The following types of comments are not acceptable on our page: vulgar/profane language, personal attacks, spam/advertisements, and comments that are off topic.",4567.0
verisk-analytics,Verisk Analytics,information services,,,,,"Verisk Analytics (Nasdaq:VRSK) is a leading data analytics provider serving customers in insurance, natural resources, and financial services. Using advanced technologies to collect and analyze billions of records, Verisk Analytics draws on unique data assets and deep domain expertise to provide first-to-market innovations that are integrated into customer workflows. Verisk offers predictive analytics and decision support solutions to customers in rating, underwriting, claims, catastrophe and weather risk, global risk analytics, natural resources intelligence, economic forecasting, and many other fields. Around the world, Verisk Analytics helps customers protect people, property, and financial assets. 

Headquartered in Jersey City, N.J., Verisk Analytics operates in 23 countries and is a member of Standard & Poor’s S&P 500® Index. In 2016, Forbes magazine named Verisk Analytics to its World’s Most Innovative Companies list and to its America’s Best Large Employers list. Verisk is one of only 14 companies in the United States to appear on both lists. For more information, please visit http://www.verisk.com.",1497.0
mondelezinternational,Mondelēz International,food production,IL,United States,1903.0,"Mondelēz International IL, United States","Mondelēz International, Inc. (NASDAQ: MDLZ) is a whole new company reimagined with a single focus in mind: create delicious moments of joy by sharing the world’s favorite brands.

Our Brands
We make some of the best-known snacks brands around the globe. Our 15 global Power Brands in biscuits (Oreo; Chips Ahoy!; TUC; belVita; Club Social and Barni), chocolate (Milka, Lacta, Toblerone, and Cadbury Dairy Milk) and gum & candy (Trident, Chiclets, Halls, Stride and Cadbury Dairy Milk Eclairs) are expected to drive 60 percent of our company’s growth going forward.

Our People 
Our 100,000+  diverse colleagues around the world are key to the success of our business. Great people and great brands. That’s who we are. 

Our Strategies
Consistently delivering top-tier growth. That's what we're doing at Mondelez International by: 
 
•	Unleashing the Power of Our People;
•	Transforming Snacking; 
•	Revolutionising Selling; 
•	Driving efficiency to fuel growth; 
•	Protecting the Well-being of our Planet.",76851.0
paypal,PayPal,internet,San Jose,United States,1998.0,"2211 North First Street San Jose, CA 95131 United States","Out with the Old. In with the New Money. New Money gives you the freedom to do what you want with your money, when you want to do it. PayPal makes it all possible and is the faster, safer way to pay and get paid online, via mobile device or in-store. The service gives people simpler ways to send money without sharing financial information, and the flexibility to pay using account balances, bank accounts, credit cards or promotional financing. With over 173 million active accounts in 203 markets and 26 currencies around the world, PayPal is the purveyor of New Money, enabling global commerce to the tune of more than 7.7 million payments every day. Because PayPal helps people transact anytime, anywhere and in any way, the company is a driving force behind the growth of mobile commerce, as it processed 12% of the world’s mobile payments in 2014. More than dollars and cents, New Money is common sense. PayPal is headquartered in San Jose, Calif. and its international headquarters is located in Singapore. More information about the company can be found at www.paypal-media.com.",24852.0
westrockcompany,WestRock Company,packaging and containers,,,2015.0,,"WestRock (NYSE:WRK) partners with our customers to provide differentiated paper and packaging solutions that help them win in the marketplace. WestRock’s 39,000 team members support customers around the world from more than 250 operating and business locations spanning North America, South America, Europe and Asia. Learn more at www.westrock.com.",5876.0
