company_id,name,industry,city,country,founded,hq,overview,emp_count
united-rentals,United Rentals,construction,Stamford,United States,1997.0,"100 First Stamford Place, Suite 700 Stamford, CT 06902 United States","As North America’s largest equipment rental company, with 880+ stores in the United States and Canada, we serve construction and industrial companies, utilities, municipalities, homeowners, and communities, with the goal of fulfilling customer needs and surpassing expectations.

We go beyond equipment. We are the world’s largest fleet of problem solvers, with best-in-class specialty solutions, safety training and 24/7 support to empower your success.

For more updates -
Follow us on Twitter: www.UnitedRentals.com/Twitter  
Like us on Facebook: www.UnitedRentals.com/Facebook 
Join us on Google+: www.UnitedRentals.com/Google
See more videos: www.UnitedRentals.com/YouTube",10770.0
nordstrom,Nordstrom,retail,,,1901.0,,"At Nordstrom, we empower our employees to set their sights high and blaze their own trails. This is a place where your success and growth are truly a result of your own efforts and achievements. 

Our teams are made up of motivated people who work hard to become leaders within the company, at all levels of the organization. These well-traveled paths show how hard work, loyalty, a competitive spirit and your unwavering commitment to the customer can take you and your career to new places.  

In addition to being a great place to have a career, we’re also committed to respecting the environment and supporting our communities. To learn more, check out NordstromCares.com.

Interested in joining the Nordstrom team?  

See some of our current opportunities under our Careers tab or visit careers.nordstrom.com to apply today.",90007.0
expeditors,Expeditors,logistics and supply chain,Seattle,United States,1979.0,"1015 3rd Ave Seattle, Washington 98104 United States","Expeditors is a global logistics company headquartered in Seattle, Washington. As a Fortune 500 (390) company, we employ over 15,300 trained professionals in a worldwide network of over 250 locations across six continents. Expeditors satisfy the increasingly sophisticated needs of international trade through customized solutions and seamless, integrated information systems. Our services include air and ocean freight consolidation and forwarding, vendor consolidation, customs clearance, cargo insurance, distribution and other value-added logistics services.

At Expeditors, we pride ourselves on being a solutions-based organization and take the time to understand each customer's individual business needs. As a non-asset based organization, we have considerable flexibility when managing customers'​ supply chains. Due to our relationships with local suppliers and global air and ocean partners, we can provide customers with the best routing and pricing options. Our comprehensive, flexible spectrum of services is supported by leading-edge information technology that provides a high level of visibility from end to end.

To maintain consistent quality and customer service across the globe, Expeditors has regional headquarters located in London, Dubai, Shanghai and Singapore. 

At Expeditors, our industry professionals, award winning processes and globally unified systems ensure that we always live up to our promise, ""You'd be surprised how far we'll go for you.""​",16713.0
jack-henry-&-associates,Jack Henry & Associates,computer software,Monett,United States,1976.0,"663 W. Highway 60 P.O. Box 807 Monett, Missouri 65708 United States","Jack Henry & Associates, Inc. provides integrated computer systems for in-house and outsourced data processing to commercial banks, credit unions, and other financial institutions primarily in the United States. The company's software systems consist of integrated applications to process deposit, loan, and general ledger transactions, and to maintain centralized customer/member information. It offers three banking platforms, including SilverLake, CIF 20/20, and Core Director; two credit union platforms comprising Episys and Cruise; and solutions for increasing security and mitigating operational risks, and controlling operating costs. 

JHA provides complementary products and services, such as business intelligence and management solutions, retail delivery solutions, business banking solutions, EFT solutions, Internet banking solutions, risk management and protection solutions, item and document imaging solutions, payment processing solutions, and professional services and education. 

Jack Henry delivers solutions to banks and credit unions  nationwide through 3 business units; Jack Henry Banking, ProfitStars, and Symitar.",4858.0
ppg-industries,PPG Industries,chemicals,Pittsburgh,United States,1883.0,"One PPG Place Pittsburgh, PA 15272 United States","PPG: WE PROTECT AND BEAUTIFY THE WORLD™
At PPG (NYSE:PPG), we work every day to develop and deliver the paints, coatings and materials that our customers have trusted for more than 130 years. Through dedication and creativity, we solve our customers’ biggest challenges, collaborating closely to find the right path forward. With headquarters in Pittsburgh, we operate and innovate in more than 70 countries and reported net sales of $14.8 billion in 2016. We serve customers in construction, consumer products, industrial and transportation markets and aftermarkets. To learn more, visit www.ppg.com and follow @PPG on Twitter.",27869.0
the-coca-cola-company,The Coca-Cola Company,food & beverages,Atlanta,United States,,"One Coca-Cola Plaza Atlanta, GA 30313 United States","The Coca-Cola Company (NYSE: KO) is the world's largest beverage company, refreshing consumers with more than 500 sparkling and still brands. Together with our bottling partners, we rank among the world's top 10 private employers with more than 700,000 system associates.

Led by Coca-Cola, one of the world's most valuable and recognizable brands, our Company's portfolio features 20 billion-dollar brands, including Diet Coke, Fanta, Sprite, Coca-Cola Zero, vitaminwater, Powerade, Minute Maid, Simply, Georgia, Dasani, FUZE TEA and Del Valle. Globally, we are the No. 1 provider of sparkling beverages, ready-to-drink coffees, and juices and juice drinks. Through the world's largest beverage distribution system, consumers in more than 200 countries enjoy our beverages at a rate of more than 1.9 billion servings a day.

With an enduring commitment to building sustainable communities, our Company is focused on initiatives that reduce our environmental footprint; support active, healthy living; create a safe, inclusive work environment for our associates; and enhance the economic development of the communities where we operate.

For more information, visit Coca-Cola Journey at www.coca-colacompany.com, follow us on Twitter at twitter.com/CocaColaCo, like us on Facebook at facebook.com/thecocacolaco, visit our blog, Coca-Cola Unbottled, at www.coca-colablog.com, or find us on LinkedIn at www.linkedin.com/company/the-coca-cola-company.",85116.0
m&t-bank,M&T Bank,financial services,Buffalo,United States,1856.0,"345 Main St. Buffalo, New York 14203 United States","M&T Bank is a multi-state community-focused bank serving New York, Maryland, New Jersey, Pennsylvania, Delaware, Connecticut, Virginia, West Virginia and Washington, D.C. Founded in 1856, the company provides banking, investment, insurance and mortgage financial services to more than 3.6 million consumer, business and government clients.

Equal Housing Lender. NMLS #381076. © 2016 M&T Bank. Member FDIC.",18587.0
tripadvisor,TripAdvisor,internet,Needham,United States,2000.0,"400 1st Ave Needham, MA 02494 United States","TripAdvisor® is the world's largest travel site**, enabling travelers to unleash the potential of every trip. TripAdvisor offers advice from millions of travelers and a wide variety of travel choices and planning features with seamless links to booking tools that check hundreds of websites to find the best hotel prices. TripAdvisor branded sites make up the largest travel community in the world, reaching 390 million average monthly unique visitors*, and reached 435 million reviews and opinions covering 6.8 million accommodations, restaurants and attractions. The sites operate in 49 markets worldwide. TripAdvisor: Know better. Book better. Go better.

TripAdvisor, Inc. (NASDAQ:TRIP), through its subsidiaries, manages and operates websites under 24 other travel media brands: 
www.airfarewatchdog.com, www.bookingbuddy.com, www.citymaps.com, www.cruisecritic.com, www.familyvacationcritic.com, www.flipkey.com, www.thefork.com (including www.lafourchette.com, www.eltenedor.com, www.iens.nl, www.besttables.com and www.dimmi.com.au), www.gateguru.com, www.holidaylettings.co.uk, www.holidaywatchdog.com, www.housetrip.com, www.independenttraveler.com, www.jetsetter.com, www.niumba.com, www.onetime.com, www.oyster.com, www.seatguru.com, www.smartertravel.com, www.tingo.com, www.travelpod.com, www.tripbod.com, www.vacationhomerentals.com, www.viator.com, and www.virtualtourist.com.

*Source: TripAdvisor log files, average monthly unique visitors, Q3 2016

**Source: comScore Media Metrix for TripAdvisor Sites, worldwide, July 2016",4542.0
sempra-energy,Sempra Energy,utilities,San Diego,United States,1998.0,"488 8th Ave San Diego, CA 92101 United States","Sempra Energy, based in San Diego, is a Fortune 500 energy services holding company with 2015 revenues of more than $10 billion. The Sempra Energy companies'​ 17,000 employees serve more than 32 million consumers worldwide.

Our California utilities, San Diego Gas & Electric Co. and Southern California Gas Co., serve more than 20 million consumers. And our other businesses develop energy infrastructure and provide related products and services to consumers around the world.

Due to our size, scope and resources, we're able to compete in energy markets both nationally and internationally. And we have the resources to take part in markets and businesses that connect people and ideas in many more ways than ever.",4333.0
texas-instruments,Texas Instruments,semiconductors,Dallas,United States,,"12500 TI Boulevard Dallas, TX 75243 United States","Texas Instruments (TI) is a global analog and digital semiconductor IC design and manufacturing company. In addition to analog technologies, digital signal processing (DSP) and microcontroller (MCU) semiconductors, TI designs and manufactures semiconductor solutions for analog and digital embedded, application processing, and Education Technology.",55645.0
varian-medical-systems,Varian Medical Systems,medical devices,Palo Alto,United States,1948.0,"Varian Medical Systems, Inc. 3100 Hansen Way Palo Alto, CA 94304-1030 United States","Our mission is to focus energy on saving lives. We equip the world with new tools for fighting cancer, taking X-ray images, and protecting our borders.

Since the 1950s we have been producing tools that harness the power of X-ray energy to benefit humankind. In recent decades, we have pioneered developments in the fields of radiotherapy, radiosurgery, X-ray tube technology, digital image detectors, cargo screening, and non-destructive testing. We have a robust product portfolio, and long-standing relationships with many of the world’s leading clinicians and manufacturers of industrial and medical imaging systems. As Varian continues to grow, our staff of over 6,500 people in 70 sales and support offices around the globe is developing innovative, cost-effective solutions that help make the world a healthier, more secure place.

Varian reserves the right to remove any comment for any reason and ban any user from its page at is sole discretion. Varian does not endorse user comments on its page and cannot confirm their accuracy. User comments do not necessarily represent the ideas, thoughts, beliefs, opinions or views of Varian, or any of its affiliates.",7752.0
darden-restaurants,Darden,restaurants,Orlando,United States,,"1000 Darden Center Drive Orlando, FL 32837 United States","Darden is a restaurant company featuring a portfolio of differentiated brands that include Olive Garden, LongHorn Steakhouse, Cheddar's Scratch Kitchen, Yard House, The Capital Grille, Seasons 52, Bahama Breeze and Eddie V's. Our people equal our success, and we are proud to employ 165,000 team members in more than 1,600 restaurants. Together, we create memorable experiences for 380 million guests each year in communities across North America.",16762.0
wellsfargo,Wells Fargo,financial services,San Francisco,United States,,"420 Montgomery St San Francisco, California 94103 United States","Wells Fargo & Company (NYSE: WFC) is a diversified, community-based financial services company with $1.9 trillion in assets. Founded in 1852 and headquartered in San Francisco, Wells Fargo provides banking, insurance, investments, mortgage, and consumer and commercial finance through more than 8,600 locations, 13,000 ATMs, the internet (wellsfargo.com) and mobile banking, and has offices in 36 countries and territories to support customers who conduct business in the global economy. With approximately 268,000 team members, Wells Fargo serves one in three households in the United States. Wells Fargo & Company was ranked No. 27 on Fortune’s 2016 rankings of America’s largest corporations. Wells Fargo’s vision is to satisfy our customers’ financial needs and help them succeed financially. Wells Fargo perspectives are also available on Wells Fargo Blogs and Wells Fargo Stories. 

Our vision: “We want to satisfy all our customers’ financial needs and help them succeed financially.”

Relevant military experience is considered for veterans and transitioning service men and women. 
Wells Fargo is an Affirmative Action and Equal Opportunity Employer, Minority/Female/Disabled/Veteran/Gender Identity/Sexual Orientation. © 2016 Wells Fargo Bank, N.A. All rights reserved. Member FDIC.",302434.0
delta-air-lines,Delta Air Lines,airlines/aviation,Atlanta,United States,1928.0,"1030 Delta Boulevard Atlanta, Georgia 30320-6001 United States","Delta Air Lines serves nearly 180 million customers each year. 

In 2016, Delta was named to Fortune’s top 50 Most Admired Companies in addition to being named the most admired airline for the fifth time in six years. Additionally, Delta has ranked No.1 in the Business Travel News Annual Airline survey for an unprecedented five consecutive years. 

With an industry-leading global network, Delta and the Delta Connection carriers offer service to 330 destinations in 61 countries on six continents. Headquartered in Atlanta, Delta employs nearly 80,000 employees worldwide and operates a mainline fleet of more than 800 aircraft. The airline is a founding member of the SkyTeam global alliance and participates in the industry’s leading transatlantic joint venture with Air France-KLM and Alitalia as well as a joint venture with Virgin Atlantic. Including its worldwide alliance partners, Delta offers customers more than 15,000 daily flights, with key hubs and markets including Amsterdam, Atlanta, Boston, Detroit, Los Angeles, Minneapolis/St. Paul, New York-JFK and LaGuardia, London-Heathrow, Paris-Charles de Gaulle, Salt Lake City, Seattle and Tokyo-Narita. 

Delta has invested billions of dollars in airport facilities, global products and services, and technology to enhance the customer experience in the air and on the ground. Additional information is available on the Delta News Hub, as well as delta.com, Twitter @DeltaNewsHub, Google.com/+Delta, Facebook.com/delta and Delta’s blog takingoff.delta.com.",51767.0
ecolab,Ecolab,chemicals,St. Paul,United States,,"370 Wabasha St. N. St. Paul, MN United States","A trusted partner at more than one million customer locations, Ecolab (ECL) is the global leader in water, hygiene and energy technologies and services that protect people and vital resources. With 2016 sales of $13 billion and 48,000 associates, Ecolab delivers comprehensive solutions and on-site service to promote safe food, maintain clean environments, optimize water and energy use and improve operational efficiencies for customers in the food, healthcare, energy, hospitality and industrial markets in more than 170 countries around the world. 

For more Ecolab news and information, visit www.ecolab.com, or follow us on twitter.com/ecolab and facebook.com/ecolab.",28572.0
united-technologies,United Technologies,aviation & aerospace,Farmington,United States,1934.0,"Farm Springs Road Farmington, CT United States","United Technologies Corporation (UTC) serves customers in the commercial aerospace, defense and building industries. Few companies can change the world - We are one. Join us! 

Our businesses include Pratt & Whitney aircraft engines, UTC Aerospace Systems, Otis elevators and escalators, and UTC Climate, Controls & Security, featuring Carrier heating, air-conditioning and fire and security solutions from brands such as Kidde and Chubb.",13767.0
newscorp,News Corp,online media,New York,United States,2013.0,"News Corp 1211 Avenue of the Americas New York, New York 10036 United States","News Corp is a global, diversified media and information services company focused on creating and distributing authoritative and engaging content to consumers throughout the world. The company comprises leading businesses across a range of media, including: news and information services, digital real estate services, book publishing, digital education, and sports programming and pay-TV distribution.

Headquartered in New York, the activities of News Corp are conducted primarily in the United States, Australia, and the United Kingdom.",5009.0
masco-corporation,Masco Corporation,building materials,,,1929.0,,"Masco Corporation is one of the world's largest manufacturers of brand name products for the home improvement and new home construction markets. Masco is also a leading provider of a variety of installed products and services, including insulation, for homebuilders. When it comes to our products and services, our reputation for quality, innovation, value, and performance is unparalleled.  Some of our major brands include Delta, Behr, KraftMaid, Merillat, Hansgrohe, Milgard, and Liberty.

Masco is also committed to providing high quality products that enhance the lives of consumers worldwide.  Our focus is on strengthening our leadership brands by delivering innovative, cost-effective and environmentally-friendly solutions for our customers.",2574.0
unionpacific,Union Pacific Railroad,transportation/trucking/railroad,Omaha,United States,1862.0,"1400 Douglas Street Omaha, NE 68179 United States","One of America's most recognized companies, Union Pacific Railroad connects 23 states in the western two-thirds of the country by rail, providing a critical link in the global supply chain. From 2007-2013, Union Pacific invested more than $21.6 billion in its network and operations to support America's transportation infrastructure. The railroad's diversified business mix includes Agricultural Products, Automotive, Chemicals, Coal, Industrial Products and Intermodal. Union Pacific serves many of the fastest-growing U.S. population centers, operates from all major West Coast and Gulf Coast ports to eastern gateways, connects with Canada's rail systems and is the only railroad serving all six major Mexico gateways. Union Pacific provides value to its roughly 10,000 customers by delivering products in a safe, reliable, fuel-efficient and environmentally responsible manner.",16857.0
snap-on-tools,Snap-on Tools,automotive,Kenosha,United States,,"2801 - 80th Street Kenosha, WI 53141 United States","Snap-on Incorporated is a leading global innovator, manufacturer and marketer of tools, equipment, diagnostics, repair information and systems solutions for professional users performing critical tasks.  Products and services include hand and power tools, tool storage, diagnostics software, information and management systems, shop equipment and other solutions for vehicle dealerships and repair centers, as well as for customers in industries, including aviation and aerospace, agriculture, construction, government and military, mining, natural resources, power generation and technical education.  Snap-on also derives income from various financing programs to facilitate the sales of its products. Products and services are sold through the company’s franchisee, company-direct, distributor and internet channels.  Founded in 1920, Snap-on is a $3.4 billion, S&P 500 company headquartered in Kenosha, Wisconsin.",6539.0
skyworks-solutions-inc,"Skyworks Solutions, Inc.",semiconductors,Woburn,United States,,"20 Sylvan Road Woburn, MA 01801 United States","Skyworks Solutions, Inc. is empowering the wireless networking revolution.  Our highly innovative analog semiconductors are connecting people, places and things spanning a number of new and previously unimagined applications within the automotive, broadband, cellular infrastructure, connected home, industrial, medical, military, smartphone, tablet and wearable markets.
Skyworks is a global company with engineering, marketing, operations, sales and support facilities located throughout Asia, Europe and North America and is a member of the S&P 500® and Nasdaq-100® market indices (NASDAQ: SWKS).  For more information, please visit Skyworks’ website at: www.skyworksinc.com. ",3585.0
ge,GE,electrical/electronic manufacturing,Boston,United States,1892.0,"41 Farnsworth St Boston, MA 02210 United States","GE (NYSE: GE) is the world’s Digital Industrial Company, transforming industry with software-defined machines and solutions that are connected, responsive and predictive. GE is organized around a global exchange of knowledge, the ""GE Store,""​ through which each business shares and accesses the same technology, markets, structure and intellect. Each invention further fuels innovation and application across our industrial sectors. With people, services, technology and scale, GE delivers better outcomes for customers by speaking the language of industry. www.ge.com",142190.0
intel-corporation,Intel Corporation,semiconductors,Santa Clara,United States,1968.0,"Robert Noyce Building Santa Clara, California 95052 United States","INTEL MAKES POSSIBLE THE MOST AMAZING EXPERIENCES OF THE FUTURE

You know us best for our processors.  But we do so much more.  We are makers, catalysts and inventors.  We innovate at the boundaries of technology to make amazing experiences possible for business and society, and for every person on Earth. 
 
Throughout our proud history, Intel has continuously expanded the reach, influence and power of computing to improve people’s everyday lives.  With more than 100,000 employees in 63 countries and customers in over 120 countries, Intel’s products and services create the foundation for limitless invention.  Our innovations are bringing sight, touch, depth-perception and the ability to communicate to devices, objects and spaces to make them smart and connected. More than an essential ingredient of the most valued devices, we harness the capability of the cloud and the Internet of Things to disrupt industries, solve global challenges — such as those in healthcare, agriculture and commerce.  We lead on important matters of policy, diversity, inclusion, education and sustainability.  
 
Intel has transformed from a company that primarily served the PC industry, to one now also powering the majority of the world’s data centers, connecting hundreds of millions of mobile and Internet of Things devices, and helping to secure and protect enterprise and government IT systems. Our manufacturing advantage - fueled by our pursuit of Moore’s Law - lets us continuously push the limits of performance and functionality and expand what experiences can be made possible.",167064.0
comerica-bank,Comerica Bank,banking,Dallas,United States,1849.0,"1717 Main Street Dallas, TX 75201 United States","Comerica Incorporated (NYSE: CMA) is a financial services company headquartered in Dallas, Texas, strategically aligned by the Business Bank, the Retail Bank, and Wealth Management. The Business Bank provides companies of all sizes with an array of credit and non-credit financial products and services. The Retail Bank delivers personalized financial products and services to consumers. Wealth Management serves the needs of high net worth clients and institutions.

Comerica’s nearly 9,000 colleagues focus on relationships, and helping people and businesses be successful.  Comerica operates in seven of the 10 largest U.S. cities, with 480 banking centers in its primary markets of Texas, Arizona, California, Florida and Michigan.  Select businesses operate in several other states, as well as in Canada and Mexico. Comerica is among the 22 largest U.S. banking companies, with $69.2 billion in total assets at December 31, 2014.

Visit Comerica's Facebook page at facebook.com/ComericaCares or on Twitter at @ComericaCares for more information on how Comerica is making a positive difference in the communities it serves.

Comerica's chief economist, Robert Dye, provides economic research, commentary and analysis.  You can follow him on Twitter at @Comerica_Econ.

To learn more about Comerica’s products, services and career opportunities, visit Comerica.com.",14645.0
